11:43:56.187518 IP 192.168.22.69.63383 > penta.ssh: Flags [.], ack 15296, win 2905, options [nop,nop,TS val 530149046 ecr 2466396082], length 0
11:43:56.193055 IP penta.ssh > 192.168.22.69.63383: Flags [P.], seq 15296:15404, ack 1225, win 2261, options [nop,nop,TS val 2466396088 ecr 530149046], length 108
11:43:56.193930 IP 192.168.22.69.63383 > penta.ssh: Flags [.], ack 15404, win 2906, options [nop,nop,TS val 530149052 ecr 2466396088], length 0
11:43:56.198618 IP penta.ssh > 192.168.22.69.63383: Flags [P.], seq 15404:15496, ack 1225, win 2261, options [nop,nop,TS val 2466396094 ecr 530149052], length 92
11:43:56.199471 IP 192.168.22.69.63383 > penta.ssh: Flags [.], ack 15496, win 2906, options [nop,nop,TS val 530149058 ecr 2466396094], length 0
11:43:56.205006 IP penta.ssh > 192.168.22.69.63383: Flags [P.], seq 15496:15588, ack 1225, win 2261, options [nop,nop,TS val 2466396100 ecr 530149058], length 92
11:43:56.205825 IP 192.168.22.69.63383 > penta.ssh: Flags [.], ack 15588, win 2907, options [nop,nop,TS val 530149064 ecr 2466396100], length 0
11:43:56.211492 IP penta.ssh > 192.168.22.69.63383: Flags [P.], seq 15588:15680, ack 1225, win 2261, options [nop,nop,TS val 2466396107 ecr 530149064], length 92
11:43:56.212361 IP 192.168.22.69.63383 > penta.ssh: Flags [.], ack 15680, win 2907, options [nop,nop,TS val 530149071 ecr 2466396107], length 0
11:43:56.219069 IP penta.ssh > 192.168.22.69.63383: Flags [P.], seq 15680:15772, ack 1225, win 2261, options [nop,nop,TS val 2466396114 ecr 530149071], length 92
11:43:56.220011 IP 192.168.22.69.63383 > penta.ssh: Flags [.], ack 15772, win 2907, options [nop,nop,TS val 530149078 ecr 2466396114], length 0
11:43:56.224640 IP penta.ssh > 192.168.22.69.63383: Flags [P.], seq 15772:15864, ack 1225, win 2261, options [nop,nop,TS val 2466396120 ecr 530149078], length 92
11:43:56.225525 IP 192.168.22.69.63383 > penta.ssh: Flags [.], ack 15864, win 2907, options [nop,nop,TS val 530149084 ecr 2466396120], length 0
11:43:56.231114 IP penta.ssh > 192.168.22.69.63383: Flags [P.], seq 15864:15956, ack 1225, win 2261, options [nop,nop,TS val 2466396127 ecr 530149084], length 92
11:43:56.232034 IP 192.168.22.69.63383 > penta.ssh: Flags [.], ack 15956, win 2907, options [nop,nop,TS val 530149090 ecr 2466396127], length 0
11:43:56.238822 IP penta.ssh > 192.168.22.69.63383: Flags [P.], seq 15956:16048, ack 1225, win 2261, options [nop,nop,TS val 2466396134 ecr 530149090], length 92
11:43:56.239627 IP 192.168.22.69.63383 > penta.ssh: Flags [.], ack 16048, win 2907, options [nop,nop,TS val 530149098 ecr 2466396134], length 0
11:43:56.245140 IP penta.ssh > 192.168.22.69.63383: Flags [P.], seq 16048:16140, ack 1225, win 2261, options [nop,nop,TS val 2466396141 ecr 530149098], length 92
11:43:56.246017 IP 192.168.22.69.63383 > penta.ssh: Flags [.], ack 16140, win 2907, options [nop,nop,TS val 530149104 ecr 2466396141], length 0
11:43:56.251608 IP penta.ssh > 192.168.22.69.63383: Flags [P.], seq 16140:16232, ack 1225, win 2261, options [nop,nop,TS val 2466396147 ecr 530149104], length 92
11:43:56.252503 IP 192.168.22.69.63383 > penta.ssh: Flags [.], ack 16232, win 2907, options [nop,nop,TS val 530149111 ecr 2466396147], length 0
11:43:56.258042 IP penta.ssh > 192.168.22.69.63383: Flags [P.], seq 16232:16324, ack 1225, win 2261, options [nop,nop,TS val 2466396153 ecr 530149111], length 92
11:43:56.259001 IP 192.168.22.69.63383 > penta.ssh: Flags [.], ack 16324, win 2907, options [nop,nop,TS val 530149117 ecr 2466396153], length 0
11:43:56.263572 IP penta.ssh > 192.168.22.69.63383: Flags [P.], seq 16324:16416, ack 1225, win 2261, options [nop,nop,TS val 2466396159 ecr 530149117], length 92
11:43:56.264456 IP 192.168.22.69.63383 > penta.ssh: Flags [.], ack 16416, win 2907, options [nop,nop,TS val 530149123 ecr 2466396159], length 0
11:43:56.265100 IP 192.168.22.69.63383 > penta.ssh: Flags [P.], seq 1225:1285, ack 16416, win 2907, options [nop,nop,TS val 530149123 ecr 2466396159], length 60
11:43:56.266993 IP penta.ssh > 192.168.22.69.63383: Flags [P.], seq 16416:16468, ack 1285, win 2261, options [nop,nop,TS val 2466396162 ecr 530149123], length 52
11:43:56.267872 IP 192.168.22.69.63383 > penta.ssh: Flags [.], ack 16468, win 2906, options [nop,nop,TS val 530149126 ecr 2466396162], length 0
11:43:56.269413 IP penta.ssh > 192.168.22.69.63383: Flags [P.], seq 16468:16640, ack 1285, win 2261, options [nop,nop,TS val 2466396165 ecr 530149126], length 172
11:43:56.270235 IP 192.168.22.69.63383 > penta.ssh: Flags [.], ack 16640, win 2907, options [nop,nop,TS val 530149128 ecr 2466396165], length 0
11:43:56.271402 IP 192.168.22.69.63383 > penta.ssh: Flags [P.], seq 1285:1345, ack 16640, win 2907, options [nop,nop,TS val 530149130 ecr 2466396165], length 60
11:43:56.276029 IP penta.ssh > 192.168.22.69.63383: Flags [P.], seq 16640:16764, ack 1345, win 2261, options [nop,nop,TS val 2466396171 ecr 530149130], length 124
11:43:56.276902 IP 192.168.22.69.63383 > penta.ssh: Flags [.], ack 16764, win 2905, options [nop,nop,TS val 530149135 ecr 2466396171], length 0
11:43:56.281490 IP penta.ssh > 192.168.22.69.63383: Flags [P.], seq 16764:16864, ack 1345, win 2261, options [nop,nop,TS val 2466396177 ecr 530149135], length 100
11:43:56.282354 IP 192.168.22.69.63383 > penta.ssh: Flags [.], ack 16864, win 2906, options [nop,nop,TS val 530149141 ecr 2466396177], length 0
11:43:56.289048 IP penta.ssh > 192.168.22.69.63383: Flags [P.], seq 16864:16956, ack 1345, win 2261, options [nop,nop,TS val 2466396184 ecr 530149141], length 92
11:43:56.289907 IP 192.168.22.69.63383 > penta.ssh: Flags [.], ack 16956, win 2906, options [nop,nop,TS val 530149148 ecr 2466396184], length 0
11:43:56.294603 IP penta.ssh > 192.168.22.69.63383: Flags [P.], seq 16956:17056, ack 1345, win 2261, options [nop,nop,TS val 2466396190 ecr 530149148], length 100
11:43:56.295117 ARP, Request who-has 192.168.43.94 tell 192.168.43.90, length 46
11:43:56.295597 IP 192.168.22.69.63383 > penta.ssh: Flags [.], ack 17056, win 2907, options [nop,nop,TS val 530149154 ecr 2466396190], length 0
11:43:56.297231 ARP, Request who-has _gateway tell 192.168.43.88, length 46
11:43:56.297327 ARP, Request who-has _gateway tell 192.168.43.88, length 46
11:43:56.297585 IP penta.35020 > 192.168.1.16.domain: 25925+ [1au] PTR? 88.43.168.192.in-addr.arpa. (55)
11:43:56.299480 IP 192.168.1.16.domain > penta.35020: 25925 NXDomain 0/1/1 (105)
11:43:56.299561 IP penta.35020 > 192.168.1.16.domain: 25925+ PTR? 88.43.168.192.in-addr.arpa. (44)
11:43:56.300205 IP 192.168.1.16.domain > penta.35020: 25925 NXDomain 0/1/0 (94)
11:43:56.301401 IP penta.ssh > 192.168.22.69.63383: Flags [P.], seq 17056:17172, ack 1345, win 2261, options [nop,nop,TS val 2466396197 ecr 530149154], length 116
11:43:56.302245 IP 192.168.22.69.63383 > penta.ssh: Flags [.], ack 17172, win 2907, options [nop,nop,TS val 530149161 ecr 2466396197], length 0
11:43:56.307982 IP penta.ssh > 192.168.22.69.63383: Flags [P.], seq 17172:17376, ack 1345, win 2261, options [nop,nop,TS val 2466396203 ecr 530149161], length 204
11:43:56.308929 IP 192.168.22.69.63383 > penta.ssh: Flags [.], ack 17376, win 2907, options [nop,nop,TS val 530149167 ecr 2466396203], length 0
11:43:56.314566 IP penta.ssh > 192.168.22.69.63383: Flags [P.], seq 17376:17468, ack 1345, win 2261, options [nop,nop,TS val 2466396210 ecr 530149167], length 92
11:43:56.315437 IP 192.168.22.69.63383 > penta.ssh: Flags [.], ack 17468, win 2907, options [nop,nop,TS val 530149174 ecr 2466396210], length 0
11:43:56.321056 IP penta.ssh > 192.168.22.69.63383: Flags [P.], seq 17468:17560, ack 1345, win 2261, options [nop,nop,TS val 2466396216 ecr 530149174], length 92
11:43:56.322018 IP 192.168.22.69.63383 > penta.ssh: Flags [.], ack 17560, win 2907, options [nop,nop,TS val 530149180 ecr 2466396216], length 0
11:43:56.326627 IP penta.ssh > 192.168.22.69.63383: Flags [P.], seq 17560:17652, ack 1345, win 2261, options [nop,nop,TS val 2466396222 ecr 530149180], length 92
11:43:56.327336 IP 192.168.22.69.63383 > penta.ssh: Flags [.], ack 17652, win 2907, options [nop,nop,TS val 530149186 ecr 2466396222], length 0
11:43:56.333926 IP penta.ssh > 192.168.22.69.63383: Flags [P.], seq 17652:17744, ack 1345, win 2261, options [nop,nop,TS val 2466396229 ecr 530149186], length 92
11:43:56.334766 IP 192.168.22.69.63383 > penta.ssh: Flags [.], ack 17744, win 2907, options [nop,nop,TS val 530149193 ecr 2466396229], length 0
11:43:56.340505 IP penta.ssh > 192.168.22.69.63383: Flags [P.], seq 17744:17836, ack 1345, win 2261, options [nop,nop,TS val 2466396236 ecr 530149193], length 92
11:43:56.341326 IP 192.168.22.69.63383 > penta.ssh: Flags [.], ack 17836, win 2907, options [nop,nop,TS val 530149200 ecr 2466396236], length 0
11:43:56.341902 IP 192.168.22.69.63383 > penta.ssh: Flags [P.], seq 1345:1405, ack 17836, win 2907, options [nop,nop,TS val 530149200 ecr 2466396236], length 60
11:43:56.343993 IP penta.ssh > 192.168.22.69.63383: Flags [P.], seq 17836:17888, ack 1405, win 2261, options [nop,nop,TS val 2466396239 ecr 530149200], length 52
11:43:56.344675 IP 192.168.22.69.63383 > penta.ssh: Flags [.], ack 17888, win 2906, options [nop,nop,TS val 530149203 ecr 2466396239], length 0
11:43:56.347355 IP penta.ssh > 192.168.22.69.63383: Flags [P.], seq 17888:18052, ack 1405, win 2261, options [nop,nop,TS val 2466396243 ecr 530149203], length 164
11:43:56.348303 IP 192.168.22.69.63383 > penta.ssh: Flags [.], ack 18052, win 2907, options [nop,nop,TS val 530149207 ecr 2466396243], length 0
11:43:56.349292 IP 192.168.22.69.63383 > penta.ssh: Flags [P.], seq 1405:1465, ack 18052, win 2907, options [nop,nop,TS val 530149208 ecr 2466396243], length 60
11:43:56.352929 IP penta.ssh > 192.168.22.69.63383: Flags [P.], seq 18052:18176, ack 1465, win 2261, options [nop,nop,TS val 2466396248 ecr 530149208], length 124
11:43:56.353777 IP 192.168.22.69.63383 > penta.ssh: Flags [.], ack 18176, win 2905, options [nop,nop,TS val 530149212 ecr 2466396248], length 0
11:43:56.359488 IP penta.ssh > 192.168.22.69.63383: Flags [P.], seq 18176:18276, ack 1465, win 2261, options [nop,nop,TS val 2466396255 ecr 530149212], length 100
11:43:56.360245 IP 192.168.22.69.63383 > penta.ssh: Flags [.], ack 18276, win 2906, options [nop,nop,TS val 530149219 ecr 2466396255], length 0
11:43:56.366966 IP penta.ssh > 192.168.22.69.63383: Flags [P.], seq 18276:18368, ack 1465, win 2261, options [nop,nop,TS val 2466396262 ecr 530149219], length 92
11:43:56.367901 IP 192.168.22.69.63383 > penta.ssh: Flags [.], ack 18368, win 2906, options [nop,nop,TS val 530149226 ecr 2466396262], length 0
11:43:56.372549 IP penta.ssh > 192.168.22.69.63383: Flags [P.], seq 18368:18460, ack 1465, win 2261, options [nop,nop,TS val 2466396268 ecr 530149226], length 92
11:43:56.373325 IP 192.168.22.69.63383 > penta.ssh: Flags [.], ack 18460, win 2907, options [nop,nop,TS val 530149232 ecr 2466396268], length 0
11:43:56.379946 IP penta.ssh > 192.168.22.69.63383: Flags [P.], seq 18460:18552, ack 1465, win 2261, options [nop,nop,TS val 2466396275 ecr 530149232], length 92
11:43:56.380885 IP 192.168.22.69.63383 > penta.ssh: Flags [.], ack 18552, win 2907, options [nop,nop,TS val 530149239 ecr 2466396275], length 0
11:43:56.385547 IP penta.ssh > 192.168.22.69.63383: Flags [P.], seq 18552:18644, ack 1465, win 2261, options [nop,nop,TS val 2466396281 ecr 530149239], length 92
11:43:56.386344 IP 192.168.22.69.63383 > penta.ssh: Flags [.], ack 18644, win 2907, options [nop,nop,TS val 530149245 ecr 2466396281], length 0
11:43:56.393095 IP penta.ssh > 192.168.22.69.63383: Flags [P.], seq 18644:18736, ack 1465, win 2261, options [nop,nop,TS val 2466396288 ecr 530149245], length 92
11:43:56.394111 IP 192.168.22.69.63383 > penta.ssh: Flags [.], ack 18736, win 2907, options [nop,nop,TS val 530149252 ecr 2466396288], length 0
11:43:56.398765 IP penta.ssh > 192.168.22.69.63383: Flags [P.], seq 18736:18828, ack 1465, win 2261, options [nop,nop,TS val 2466396294 ecr 530149252], length 92
11:43:56.399633 IP 192.168.22.69.63383 > penta.ssh: Flags [.], ack 18828, win 2907, options [nop,nop,TS val 530149258 ecr 2466396294], length 0
11:43:56.405326 IP penta.ssh > 192.168.22.69.63383: Flags [P.], seq 18828:18920, ack 1465, win 2261, options [nop,nop,TS val 2466396301 ecr 530149258], length 92
11:43:56.406260 IP 192.168.22.69.63383 > penta.ssh: Flags [.], ack 18920, win 2907, options [nop,nop,TS val 530149264 ecr 2466396301], length 0
11:43:56.412999 IP penta.ssh > 192.168.22.69.63383: Flags [P.], seq 18920:19012, ack 1465, win 2261, options [nop,nop,TS val 2466396308 ecr 530149264], length 92
11:43:56.413713 IP 192.168.22.69.63383 > penta.ssh: Flags [.], ack 19012, win 2907, options [nop,nop,TS val 530149272 ecr 2466396308], length 0
11:43:56.419401 IP penta.ssh > 192.168.22.69.63383: Flags [P.], seq 19012:19104, ack 1465, win 2261, options [nop,nop,TS val 2466396315 ecr 530149272], length 92
11:43:56.420391 IP 192.168.22.69.63383 > penta.ssh: Flags [.], ack 19104, win 2907, options [nop,nop,TS val 530149279 ecr 2466396315], length 0
11:43:56.426083 IP penta.ssh > 192.168.22.69.63383: Flags [P.], seq 19104:19196, ack 1465, win 2261, options [nop,nop,TS val 2466396321 ecr 530149279], length 92
11:43:56.427073 IP 192.168.22.69.63383 > penta.ssh: Flags [.], ack 19196, win 2907, options [nop,nop,TS val 530149285 ecr 2466396321], length 0
11:43:56.431873 IP penta.ssh > 192.168.22.69.63383: Flags [P.], seq 19196:19288, ack 1465, win 2261, options [nop,nop,TS val 2466396327 ecr 530149285], length 92
11:43:56.432819 IP 192.168.22.69.63383 > penta.ssh: Flags [.], ack 19288, win 2907, options [nop,nop,TS val 530149291 ecr 2466396327], length 0
11:43:56.433342 IP 192.168.22.69.63383 > penta.ssh: Flags [P.], seq 1465:1525, ack 19288, win 2907, options [nop,nop,TS val 530149291 ecr 2466396327], length 60
11:43:56.435324 IP penta.ssh > 192.168.22.69.63383: Flags [P.], seq 19288:19340, ack 1525, win 2261, options [nop,nop,TS val 2466396331 ecr 530149291], length 52
11:43:56.436084 IP 192.168.22.69.63383 > penta.ssh: Flags [.], ack 19340, win 2906, options [nop,nop,TS val 530149294 ecr 2466396331], length 0
11:43:56.436570 IP 192.168.22.69.63383 > penta.ssh: Flags [P.], seq 1525:1585, ack 19340, win 2907, options [nop,nop,TS val 530149294 ecr 2466396331], length 60
11:43:56.438188 IP penta.ssh > 192.168.22.69.63383: Flags [P.], seq 19340:19536, ack 1585, win 2261, options [nop,nop,TS val 2466396334 ecr 530149294], length 196
11:43:56.438849 IP 192.168.22.69.63383 > penta.ssh: Flags [.], ack 19536, win 2904, options [nop,nop,TS val 530149297 ecr 2466396334], length 0
11:43:56.444491 IP penta.ssh > 192.168.22.69.63383: Flags [P.], seq 19536:19636, ack 1585, win 2261, options [nop,nop,TS val 2466396340 ecr 530149297], length 100
11:43:56.445271 IP 192.168.22.69.63383 > penta.ssh: Flags [.], ack 19636, win 2906, options [nop,nop,TS val 530149304 ecr 2466396340], length 0
11:43:56.451929 IP penta.ssh > 192.168.22.69.63383: Flags [P.], seq 19636:19728, ack 1585, win 2261, options [nop,nop,TS val 2466396347 ecr 530149304], length 92
11:43:56.452820 IP 192.168.22.69.63383 > penta.ssh: Flags [.], ack 19728, win 2906, options [nop,nop,TS val 530149311 ecr 2466396347], length 0
11:43:56.458526 IP penta.ssh > 192.168.22.69.63383: Flags [P.], seq 19728:19820, ack 1585, win 2261, options [nop,nop,TS val 2466396354 ecr 530149311], length 92
11:43:56.459508 IP 192.168.22.69.63383 > penta.ssh: Flags [.], ack 19820, win 2907, options [nop,nop,TS val 530149318 ecr 2466396354], length 0
11:43:56.465196 IP penta.ssh > 192.168.22.69.63383: Flags [P.], seq 19820:19912, ack 1585, win 2261, options [nop,nop,TS val 2466396361 ecr 530149318], length 92
11:43:56.466059 IP 192.168.22.69.63383 > penta.ssh: Flags [.], ack 19912, win 2907, options [nop,nop,TS val 530149324 ecr 2466396361], length 0
11:43:56.470706 IP penta.ssh > 192.168.22.69.63383: Flags [P.], seq 19912:20004, ack 1585, win 2261, options [nop,nop,TS val 2466396366 ecr 530149324], length 92
11:43:56.471381 IP 192.168.22.69.63383 > penta.ssh: Flags [.], ack 20004, win 2907, options [nop,nop,TS val 530149329 ecr 2466396366], length 0
11:43:56.476962 IP penta.ssh > 192.168.22.69.63383: Flags [P.], seq 20004:20096, ack 1585, win 2261, options [nop,nop,TS val 2466396372 ecr 530149329], length 92
11:43:56.477714 IP 192.168.22.69.63383 > penta.ssh: Flags [.], ack 20096, win 2907, options [nop,nop,TS val 530149336 ecr 2466396372], length 0
11:43:56.483273 IP penta.ssh > 192.168.22.69.63383: Flags [P.], seq 20096:20188, ack 1585, win 2261, options [nop,nop,TS val 2466396379 ecr 530149336], length 92
11:43:56.484255 IP 192.168.22.69.63383 > penta.ssh: Flags [.], ack 20188, win 2907, options [nop,nop,TS val 530149342 ecr 2466396379], length 0
11:43:56.489887 IP penta.ssh > 192.168.22.69.63383: Flags [P.], seq 20188:20280, ack 1585, win 2261, options [nop,nop,TS val 2466396385 ecr 530149342], length 92
11:43:56.490815 IP 192.168.22.69.63383 > penta.ssh: Flags [.], ack 20280, win 2907, options [nop,nop,TS val 530149349 ecr 2466396385], length 0
11:43:56.496572 IP penta.ssh > 192.168.22.69.63383: Flags [P.], seq 20280:20372, ack 1585, win 2261, options [nop,nop,TS val 2466396392 ecr 530149349], length 92
11:43:56.497435 IP 192.168.22.69.63383 > penta.ssh: Flags [.], ack 20372, win 2907, options [nop,nop,TS val 530149356 ecr 2466396392], length 0
11:43:56.503092 IP penta.ssh > 192.168.22.69.63383: Flags [P.], seq 20372:20464, ack 1585, win 2261, options [nop,nop,TS val 2466396398 ecr 530149356], length 92
11:43:56.503980 IP 192.168.22.69.63383 > penta.ssh: Flags [.], ack 20464, win 2907, options [nop,nop,TS val 530149362 ecr 2466396398], length 0
11:43:56.508636 IP penta.ssh > 192.168.22.69.63383: Flags [P.], seq 20464:20556, ack 1585, win 2261, options [nop,nop,TS val 2466396404 ecr 530149362], length 92
11:43:56.509660 IP 192.168.22.69.63383 > penta.ssh: Flags [.], ack 20556, win 2907, options [nop,nop,TS val 530149368 ecr 2466396404], length 0
11:43:56.511778 IP 192.168.22.69.63383 > penta.ssh: Flags [P.], seq 1585:1645, ack 20556, win 2907, options [nop,nop,TS val 530149370 ecr 2466396404], length 60
11:43:56.511796 IP 192.168.22.69.63383 > penta.ssh: Flags [P.], seq 1645:1705, ack 20556, win 2907, options [nop,nop,TS val 530149370 ecr 2466396404], length 60
11:43:56.511849 IP penta.ssh > 192.168.22.69.63383: Flags [.], ack 1705, win 2261, options [nop,nop,TS val 2466396407 ecr 530149370], length 0



13:28:46.320600 ARP, Reply 192.168.40.55 is-at 92:96:5c:ad:a3:6d (oui Unknown), length 28
13:28:46.367143 ARP, Request who-has _gateway tell 192.168.43.198, length 46